paper_id	indicator_id	indicator_text	section_or_category	indicator_type	scoring_rule	source_quote	notes
sunlight_2015	lobbyist_activity	Lobbyist Activity	Lobbyist Activity	ordinal	Tier 2: Lobbyists report the bill/action discussed and position taken; Tier 1: Lobbyists report the bill/action discussed; Tier 0: Lobbyists report the general subjects of lobbying; Tier -1: Lobbyists do not report activity	"1. Lobbyist Activity: Do lobbyists have to reveal which pieces of legislation or executive actions they are seeking to influence?" papers/text/Sunlight_2015__state_lobbying_disclosure_scorecard.txt:138-139	4-tier ordinal scale (range -1 to 2). Captures both whether activity is reported and whether the lobbyist's position on the bill is included.
sunlight_2015	expenditure_transparency	Expenditure Transparency	Expenditure Transparency	ordinal	Tier 2: Lobbyists report itemized list of expenses with dates and description of direct expenditure; Tier 1: Lobbyists report list of expenses categorized under broad descriptions, e.g. food, travel, meetings, media, etc.; Tier 0: Lobbyists report lump total of expenditures; Tier -1: Lobbyists do not report total expenditures	"2. Expenditure Transparency: Are lobbyists required to itemize all the expenses associated with their work, such as travel, holding an event, or buying gifts for lawmakers?" papers/text/Sunlight_2015__state_lobbying_disclosure_scorecard.txt:140-146	4-tier ordinal scale (range -1 to 2). Measures granularity of expenditure reporting: itemized vs categorized vs lump-sum vs not reported.
sunlight_2015	expenditure_reporting_thresholds	Expenditure Reporting Thresholds	Expenditure Reporting Thresholds	ordinal	Tier 0: Lobbyists must disclose all expenditures; Tier -1: Lobbyists do not need to disclose individual expenditures or event expenses if under a certain amount	"3. Expenditure Reporting Thresholds: Does the state require lobbyists to include all expenses in reports, or only those above a certain amount?" papers/text/Sunlight_2015__state_lobbying_disclosure_scorecard.txt:147-149	2-tier ordinal scale (range -1 to 0). Note: only 2 tiers, not 4 — the rubric does not differentiate between threshold magnitudes (e.g., $2 vs $50 thresholds both score -1). The narrative discusses thresholds ranging from $2 to $50 with $25 average but the rubric collapses to binary.
sunlight_2015	document_accessibility	Document Accessibility	Document Accessibility	ordinal	Tier 2: State asks lobbyist to file digitally and makes blank or filled out digital forms publicly available; Tier 1: Public can find lobbyist registration and expenditure forms online; Tier 0: Public can access blank forms online; Tier -1: Public cannot access either the lobbyist registration form or the expenditure report online; Tier -2: Public cannot access both the lobbyist registration form or the expenditure report online	"4. Document Accessibility: In order to know whether the state could be making more information publicly available, it’s important to know what information they collect. Can the public access lobbyist registration and expenditure forms?" papers/text/Sunlight_2015__state_lobbying_disclosure_scorecard.txt:150-153	5-tier ordinal scale (range -2 to 2), not 4-tier. Note: the criterion is labeled "Document Accessibility" in the criteria list (line 150) and CSV header, but the rubric heading on line 178 says "Form Accessibility" — same indicator under two labels. Tier descriptors -1 and -2 are nearly identical in wording ("either" vs "both") — likely a typo in source where -2 should mean "neither" form accessible; preserved verbatim.
sunlight_2015	lobbyist_compensation	Lobbyist Compensation	Lobbyist Compensation	ordinal	Tier 0: Lobbyists disclose earnings received from client/employer for lobbying; Tier -1: Lobbyists do not disclose earnings received from client/employer for lobbying	"5. Lobbyist Compensation: Does the state mandate that lobbyists disclose how much they receive from a client?" papers/text/Sunlight_2015__state_lobbying_disclosure_scorecard.txt:154-155	2-tier ordinal scale (range -1 to 0), effectively boolean. Only 2 tiers, not 4.
