paper,indicator_id,indicator_text,section,blob,topics,ntopics,indicator_text_raw
CPI_2015,C01,Public access to information,13_categories,public access to information 13_categories,[],0,Public access to information
CPI_2015,C02,Political financing,13_categories,political financing 13_categories,[],0,Political financing
CPI_2015,C03,Electoral oversight,13_categories,electoral oversight 13_categories,[],0,Electoral oversight
CPI_2015,C04,Executive accountability,13_categories,executive accountability 13_categories,[],0,Executive accountability
CPI_2015,C05,Legislative accountability,13_categories,legislative accountability 13_categories,[],0,Legislative accountability
CPI_2015,C06,Judicial accountability,13_categories,judicial accountability 13_categories,[],0,Judicial accountability
CPI_2015,C07,State budget processes,13_categories,state budget processes 13_categories,[],0,State budget processes
CPI_2015,C08,State civil service management,13_categories,state civil service management 13_categories,[],0,State civil service management
CPI_2015,C09,Procurement,13_categories,procurement 13_categories,[],0,Procurement
CPI_2015,C10,Internal auditing,13_categories,internal auditing 13_categories,['enforce_audits'],1,Internal auditing
CPI_2015,C11,Lobbying disclosure,13_categories,lobbying disclosure 13_categories,[],0,Lobbying disclosure
CPI_2015,C12,State pension fund management,13_categories,state pension fund management 13_categories,[],0,State pension fund management
CPI_2015,C13,Ethics enforcement agencies,13_categories,ethics enforcement agencies 13_categories,[],0,Ethics enforcement agencies
CPI_2015,Q_LA1,"Whether lawmakers are required to file financial interest disclosures, and also whether they are complete and detailed",Legislative accountability,"whether lawmakers are required to file financial interest disclosures, and also whether they are complete and detailed legislative accountability",['disc_business_assoc'],1,"Whether lawmakers are required to file financial interest disclosures, and also whether they are complete and detailed"
CPI_2015,Q_AI1,Whether citizens actually receive responses to their requests swiftly and at reasonable cost,Public access to information,whether citizens actually receive responses to their requests swiftly and at reasonable cost public access to information,[],0,Whether citizens actually receive responses to their requests swiftly and at reasonable cost
CPI_2015,Q_OD,Whether governments are meeting open data principles (per-category sub-questions),Cross-cutting (added in 2015),whether governments are meeting open data principles (per-category sub-questions) cross-cutting (added in 2015),['access_bulk'],1,Whether governments are meeting open data principles (per-category sub-questions)
HiredGuns,Q1,definition recognizes executive branch lobbyists in addition to legislative lobbyists,Deﬁnition of Lobbyist,"in addition to legislative lobbyists, does the deﬁnition recognize executive branch lobbyists? deﬁnition of lobbyist",[],0,"In addition to legislative lobbyists, does the deﬁnition recognize executive branch lobbyists?"
HiredGuns,Q2,"threshold to qualify as a lobbyist or to prompt registration as a lobbyist, according to the definition: an individual make/spend",Deﬁnition of Lobbyist,"how much does an individual have to make/spend to qualify as a lobbyist or to prompt registration as a lobbyist, according to the deﬁnition? deﬁnition of lobbyist","['def_who_lobbies', 'timeliness']",2,"How much does an individual have to make/spend to qualify as a lobbyist or to prompt registration as a lobbyist, according to the deﬁnition?"
HiredGuns,Q3,lobbyist required to file a registration form,Individual Registration,is a lobbyist required to ﬁle a registration form? individual registration,['reg_register'],1,Is a lobbyist required to ﬁle a registration form?
HiredGuns,Q4,days before registration is required: lobbying take place,Individual Registration,how many days can lobbying take place before registration is required? individual registration,[],0,How many days can lobbying take place before registration is required?
HiredGuns,Q5,subject matter or bill number on registration forms,Individual Registration,is subject matter or bill number to be addressed by a lobbyist required on registration forms? individual registration,"['reg_register', 'disc_bills', 'disc_subject']",3,Is subject matter or bill number to be addressed by a lobbyist required on registration forms?
HiredGuns,Q6,frequency: registration by a lobbyist required,Individual Registration,how often is registration by a lobbyist required? individual registration,['freq_cadence'],1,How often is registration by a lobbyist required?
HiredGuns,Q7,days within which a lobbyist notify the oversight agency of changes in registration,Individual Registration,within how many days must a lobbyist notify the oversight agency of changes in registration? individual registration,['enforce_oversight_body'],1,Within how many days must a lobbyist notify the oversight agency of changes in registration?
HiredGuns,Q8,lobbyist required to submit a photograph with registration,Individual Registration,is a lobbyist required to submit a photograph with registration? individual registration,[],0,Is a lobbyist required to submit a photograph with registration?
HiredGuns,Q9,lobbyist required to identify by name each employer on the registration form,Individual Registration,is a lobbyist required to identify by name each employer on the registration form? individual registration,['reg_register'],1,Is a lobbyist required to identify by name each employer on the registration form?
HiredGuns,Q10,"lobbyist required to include on the registration form any additional information about the type of lobbying work he or she does (i.e., compensated or non-compensated/contract or salaried)",Individual Registration,"is a lobbyist required to include on the registration form any additional information about the type of lobbying work he or she does (i.e., compensated or non-compensated/contract or salaried)? individual registration",['reg_register'],1,"Is a lobbyist required to include on the registration form any additional information about the type of lobbying work he or she does (i.e., compensated or non-compensated/contract or salaried)?"
HiredGuns,Q11,lobbyist required to file a spending report,Individual Spending Disclosure,is a lobbyist required to ﬁle a spending report? individual spending disclosure,[],0,Is a lobbyist required to ﬁle a spending report?
HiredGuns,Q12,frequency: a lobbyist required to report spending,Individual Spending Disclosure,how often during each two-year cycle is a lobbyist required to report spending? individual spending disclosure,['freq_cadence'],1,How often during each two-year cycle is a lobbyist required to report spending?
HiredGuns,Q13,compensation/salary reported by a lobbyist on spending reports,Individual Spending Disclosure,is compensation/salary required to be reported by a lobbyist on spending reports? individual spending disclosure,[],0,Is compensation/salary required to be reported by a lobbyist on spending reports?
HiredGuns,Q14,"summary totals of spending classified by category types (i.e., gifts, entertainment, postage, etc.)",Individual Spending Disclosure,"are summaries (totals) of spending classiﬁed by category types (i.e., gifts, entertainment, postage, etc.)? individual spending disclosure",['disc_gifts'],1,"Are summaries (totals) of spending classiﬁed by category types (i.e., gifts, entertainment, postage, etc.)?"
HiredGuns,Q15,spending itemized,Individual Spending Disclosure,what spending must be itemized? individual spending disclosure,['disc_exp_itemized'],1,What spending must be itemized?
HiredGuns,Q16,lobbyist employer/principal on whose behalf the itemized expenditure was made identified,Individual Spending Disclosure,is the lobbyist employer/principal on whose behalf the itemized expenditure was made required to be identiﬁed? individual spending disclosure,"['reg_client', 'disc_exp_itemized']",2,Is the lobbyist employer/principal on whose behalf the itemized expenditure was made required to be identiﬁed?
HiredGuns,Q17,recipient of the itemized expenditure identified,Individual Spending Disclosure,is the recipient of the itemized expenditure required to be identiﬁed? individual spending disclosure,['disc_exp_itemized'],1,Is the recipient of the itemized expenditure required to be identiﬁed?
HiredGuns,Q18,date of the itemized expenditure reported,Individual Spending Disclosure,is the date of the itemized expenditure required to be reported? individual spending disclosure,['disc_exp_itemized'],1,Is the date of the itemized expenditure required to be reported?
HiredGuns,Q19,description of the itemized expenditure reported,Individual Spending Disclosure,is a description of the itemized expenditure required to be reported? individual spending disclosure,['disc_exp_itemized'],1,Is a description of the itemized expenditure required to be reported?
HiredGuns,Q20,subject matter or bill number on spending reports,Individual Spending Disclosure,is subject matter or bill number to be addressed by a lobbyist required on spending reports? individual spending disclosure,"['disc_bills', 'disc_subject']",2,Is subject matter or bill number to be addressed by a lobbyist required on spending reports?
HiredGuns,Q21,spending on household members of public officials by a lobbyist,Individual Spending Disclosure,is spending on household members of public ofﬁcials by a lobbyist required to be reported? individual spending disclosure,['reg_org_subsidiary'],1,Is spending on household members of public ofﬁcials by a lobbyist required to be reported?
HiredGuns,Q22,"lobbyist required to disclose direct business associations with public officials, candidates or members of their households",Individual Spending Disclosure,"is a lobbyist required to disclose direct business associations with public ofﬁcials, candidates or members of their households? individual spending disclosure","['reg_org_subsidiary', 'disc_business_assoc']",2,"Is a lobbyist required to disclose direct business associations with public ofﬁcials, candidates or members of their households?"
HiredGuns,Q23,a lobbyist giving and reporting gifts,Individual Spending Disclosure,what is the statutory provision for a lobbyist giving and reporting gifts? individual spending disclosure,['disc_gifts'],1,What is the statutory provision for a lobbyist giving and reporting gifts?
HiredGuns,Q25,lobbyist who has done no spending during a filing period required to make a report of no activity,Individual Spending Disclosure,is a lobbyist who has done no spending during a ﬁling period required to make a report of no activity? individual spending disclosure,[],0,Is a lobbyist who has done no spending during a ﬁling period required to make a report of no activity?
HiredGuns,Q26,employer or principal of lobbyist required to file a spending report,Employer Spending Disclosure,is an employer or principal of a lobbyist required to ﬁle a spending report? employer spending disclosure,[],0,Is an employer or principal of a lobbyist required to ﬁle a spending report?
HiredGuns,Q27,compensation/salary reported on employer/principal spending reports,Employer Spending Disclosure,is compensation/salary required to be reported on employer/principal spending reports? employer spending disclosure,[],0,Is compensation/salary required to be reported on employer/principal spending reports?
HiredGuns,Q28,oversight agency provides lobbyists/employers with online registration,Electronic Filing,does the oversight agency provide lobbyists/employers with online registration? electronic filing,"['e_filing', 'enforce_oversight_body']",2,Does the oversight agency provide lobbyists/employers with online registration?
HiredGuns,Q29,oversight agency provides lobbyists/employers with online spending reporting,Electronic Filing,does the oversight agency provide lobbyists/employers with online spending reporting? electronic filing,"['e_filing', 'enforce_oversight_body']",2,Does the oversight agency provide lobbyists/employers with online spending reporting?
HiredGuns,Q30,oversight agency provides training about how to file registrations/spending reports electronically,Electronic Filing,does the oversight agency provide training about how to ﬁle registrations/spending reports electronically? electronic filing,"['e_filing', 'enforce_oversight_body', 'training']",3,Does the oversight agency provide training about how to ﬁle registrations/spending reports electronically?
HiredGuns,Q31,Location/format of registrations or active lobbyist directory,Public Access,location/format of registrations or active lobbyist directory public access,[],0,Location/format of registrations or active lobbyist directory
HiredGuns,Q32,Location/format of spending reports,Public Access,location/format of spending reports public access,[],0,Location/format of spending reports
HiredGuns,Q33,Cost of copies,Public Access,cost of copies public access,[],0,Cost of copies
HiredGuns,Q34,sample registration forms/spending reports availability the Web,Public Access,are sample registration forms/spending reports available the web? public access,['reg_register'],1,Are sample registration forms/spending reports available the Web?
HiredGuns,Q35,state agency provides an overall lobbying spending total by year,Public Access,does the state agency provide an overall lobbying spending total by year? public access,[],0,Does the state agency provide an overall lobbying spending total by year?
HiredGuns,Q36,state agency provides an overall lobbying spending total by spending-report deadlines,Public Access,does the state agency provide an overall lobbying spending total by spending-report deadlines? public access,['timeliness'],1,Does the state agency provide an overall lobbying spending total by spending-report deadlines?
HiredGuns,Q37,state agency provides an overall lobbying spending total by industries lobbyists represent,Public Access,does the state agency provide an overall lobbying spending total by industries lobbyists represent? public access,[],0,Does the state agency provide an overall lobbying spending total by industries lobbyists represent?
HiredGuns,Q38,frequency: lobby lists updated,Public Access,how often are lobby lists updated? public access,['freq_cadence'],1,How often are lobby lists updated?
HiredGuns,Q39,state has statutory auditing authority,Enforcement,does the state have statutory auditing authority? enforcement,['enforce_audits'],1,Does the state have statutory auditing authority?
HiredGuns,Q40,state agency conducts mandatory reviews or audits,Enforcement,does the state agency conduct mandatory reviews or audits? enforcement,['enforce_audits'],1,Does the state agency conduct mandatory reviews or audits?
HiredGuns,Q41,statutory penalty for late filing of lobby registration form,Enforcement,is there a statutory penalty for late ﬁling of lobby registration form? enforcement,"['reg_register', 'penalties']",2,Is there a statutory penalty for late ﬁling of lobby registration form?
HiredGuns,Q42,statutory penalty for late filing of a lobby spending report,Enforcement,is there a statutory penalty for late ﬁling of a lobby spending report? enforcement,['penalties'],1,Is there a statutory penalty for late ﬁling of a lobby spending report?
HiredGuns,Q43,a penalty for late filing of a lobby spending report last levied,Enforcement,when was a penalty for late ﬁling of a lobby spending report last levied? enforcement,['penalties'],1,When was a penalty for late ﬁling of a lobby spending report last levied?
HiredGuns,Q44,statutory penalty for incomplete filing of a lobby registration form,Enforcement,is there a statutory penalty for incomplete ﬁling of a lobby registration form? enforcement,"['reg_register', 'penalties']",2,Is there a statutory penalty for incomplete ﬁling of a lobby registration form?
HiredGuns,Q45,statutory penalty for incomplete filing of a lobby spending report,Enforcement,is there a statutory penalty for incomplete ﬁling of a lobby spending report? enforcement,['penalties'],1,Is there a statutory penalty for incomplete ﬁling of a lobby spending report?
HiredGuns,Q46,a penalty for incomplete filing of a lobby spending report last levied,Enforcement,when was a penalty for incomplete ﬁling of a lobby spending report last levied? enforcement,['penalties'],1,When was a penalty for incomplete ﬁling of a lobby spending report last levied?
HiredGuns,Q47,state publishes a list of delinquent filers either on the Web or in a printed document,Enforcement,does the state publish a list of delinquent ﬁlers either on the web or in a printed document? enforcement,[],0,Does the state publish a list of delinquent ﬁlers either on the Web or in a printed document?
HiredGuns,Q48,cooling-off period before legislators can register as lobbyists,Revolving Door Provision,"is there a ""cooling off"" period required before legislators can register as lobbyists? revolving door provision",['disc_revolving'],1,"Is there a ""cooling off"" period required before legislators can register as lobbyists?"
Newmark2005,def_legislative_lobbying,legislative lobbying,definitions,legislative lobbying definitions,['def_what_lobbying'],1,legislative lobbying
Newmark2005,def_administrative_agency_lobbying,administrative agency lobbying,definitions,administrative agency lobbying definitions,['def_what_lobbying'],1,administrative agency lobbying
Newmark2005,def_elected_officials_as_lobbyists,elected officials as lobbyists,definitions,elected officials as lobbyists definitions,['def_exempt_officials'],1,elected officials as lobbyists
Newmark2005,def_public_employees_as_lobbyists,public employees as lobbyists,definitions,public employees as lobbyists definitions,[],0,public employees as lobbyists
Newmark2005,def_compensation_standard,compensation standard,definitions,compensation standard definitions,['def_threshold_money'],1,compensation standard
Newmark2005,def_expenditure_standard,expenditure standard,definitions,expenditure standard definitions,['def_threshold_money'],1,expenditure standard
Newmark2005,def_time_standard,time standard,definitions,time standard definitions,['def_threshold_time'],1,time standard
Newmark2005,freq_reporting_more_than_annual,frequency of reporting (more frequently than once per year),frequency of reporting,frequency of reporting (more frequently than once per year) frequency of reporting,['freq_cadence'],1,frequency of reporting (more frequently than once per year)
Newmark2005,prohib_campaign_contrib_any_time,campaign contributions at any time,prohibited activities,campaign contributions at any time prohibited activities,"['disc_camp_contrib', 'proh_camp_contrib']",2,campaign contributions at any time
Newmark2005,prohib_campaign_contrib_during_session,campaign contributions during the legislative session,prohibited activities,campaign contributions during the legislative session prohibited activities,"['disc_camp_contrib', 'proh_camp_contrib']",2,campaign contributions during the legislative session
Newmark2005,prohib_expenditures_over_threshold,expenditures in excess of a certain dollar amount per year,prohibited activities,expenditures in excess of a certain dollar amount per year prohibited activities,['proh_gifts'],1,expenditures in excess of a certain dollar amount per year
Newmark2005,prohib_solicitation_by_officials,solicitation by officials or employees for contributions or gifts,prohibited activities,solicitation by officials or employees for contributions or gifts prohibited activities,"['disc_gifts', 'proh_solicitation']",2,solicitation by officials or employees for contributions or gifts
Newmark2005,disc_legislative_admin_action_to_influence,legislative/administrative action seeking to influence,disclosure requirements,legislative/administrative action seeking to influence disclosure requirements,[],0,legislative/administrative action seeking to influence
Newmark2005,disc_expenditures_benefiting_officials,expenditures benefiting public officials or employees,disclosure requirements,expenditures benefiting public officials or employees disclosure requirements,[],0,expenditures benefiting public officials or employees
Newmark2005,disc_compensation_by_employer,compensation received broken down by employers,disclosure requirements,compensation received broken down by employers disclosure requirements,['disc_comp_by_client'],1,compensation received broken down by employers
Newmark2005,disc_total_compensation,total compensation received,disclosure requirements,total compensation received disclosure requirements,['disc_comp_total'],1,total compensation received
Newmark2005,disc_categories_of_expenditures,categories of expenditures,disclosure requirements,categories of expenditures disclosure requirements,['disc_exp_categories'],1,categories of expenditures
Newmark2005,disc_total_expenditures,total expenditures,disclosure requirements,total expenditures disclosure requirements,['disc_exp_total'],1,total expenditures
Newmark2017,def.legislative_lobbying,Legislative lobbying (registration trigger),Definitions of lobbyists and registration requirements,legislative lobbying necessitates registering as a lobbyist definitions of lobbyists and registration requirements,"['def_who_lobbies', 'def_what_lobbying']",2,Legislative lobbying necessitates registering as a lobbyist
Newmark2017,def.administrative_agency_lobbying,Administrative agency lobbying (registration trigger),Definitions of lobbyists and registration requirements,administrative agency lobbying necessitates registering as a lobbyist definitions of lobbyists and registration requirements,"['def_who_lobbies', 'def_what_lobbying']",2,Administrative agency lobbying necessitates registering as a lobbyist
Newmark2017,def.elective_officials_as_lobbyists,Elective officials (lobbyist definition),Definitions of lobbyists and registration requirements,elective officials are defined as lobbyists if engaged in lobbying-related behaviors definitions of lobbyists and registration requirements,"['def_who_lobbies', 'def_exempt_officials', 'penalties']",3,Elective officials are defined as lobbyists if engaged in lobbying-related behaviors
Newmark2017,def.public_employees_as_lobbyists,Public employees (lobbyist definition),Definitions of lobbyists and registration requirements,public employees are defined as lobbyists if engaged in lobbying-related behaviors definitions of lobbyists and registration requirements,"['def_who_lobbies', 'penalties']",2,Public employees are defined as lobbyists if engaged in lobbying-related behaviors
Newmark2017,def.compensation_standard,Compensation (lobbyist threshold),Definitions of lobbyists and registration requirements,compensation standard for lobbyist status (state defines persons as lobbyists if they receive a certain amount of money in exchange for lobbying) definitions of lobbyists and registration requirements,"['def_threshold_money', 'penalties']",2,Compensation standard for lobbyist status (state defines persons as lobbyists if they receive a certain amount of money in exchange for lobbying)
Newmark2017,def.expenditure_standard,Expenditure (lobbyist threshold),Definitions of lobbyists and registration requirements,expenditure standard for lobbyist status (state defines persons as lobbyists if they spend a certain amount of money in lobbying) definitions of lobbyists and registration requirements,"['def_threshold_money', 'penalties']",2,Expenditure standard for lobbyist status (state defines persons as lobbyists if they spend a certain amount of money in lobbying)
Newmark2017,def.time_standard,Time (lobbyist threshold),Definitions of lobbyists and registration requirements,time standard for lobbyist status (state defines persons as lobbyists if they devote a certain amount of time in lobbying) definitions of lobbyists and registration requirements,"['def_threshold_time', 'penalties']",2,Time standard for lobbyist status (state defines persons as lobbyists if they devote a certain amount of time in lobbying)
Newmark2017,prohib.contributions_anytime,making campaign contributions at any time (prohibited),Prohibited activities,lobbyists prohibited from making campaign contributions at any time prohibited activities,"['disc_camp_contrib', 'proh_camp_contrib']",2,Lobbyists prohibited from making campaign contributions at any time
Newmark2017,prohib.contributions_during_session,making campaign contributions during legislative sessions (prohibited),Prohibited activities,lobbyists prohibited from making campaign contributions during legislative sessions prohibited activities,"['disc_camp_contrib', 'proh_camp_contrib']",2,Lobbyists prohibited from making campaign contributions during legislative sessions
Newmark2017,prohib.solicitation_by_officials,Solicitation by officials or employees for contributions or gifts (prohibited),Prohibited activities,solicitation by officials or employees for contributions or gifts is prohibited prohibited activities,"['disc_gifts', 'proh_solicitation']",2,Solicitation by officials or employees for contributions or gifts is prohibited
Newmark2017,prohib.contingent_compensation,Contingent compensation (prohibited),Prohibited activities,contingent compensation is prohibited (lobbyists receiving pay only on achieving a lobbying-related objective) prohibited activities,['proh_contingent'],1,Contingent compensation is prohibited (lobbyists receiving pay only on achieving a lobbying-related objective)
Newmark2017,prohib.revolving_door,revolving door restrictions,Prohibited activities,revolving door restrictions (lawmakers prohibited from becoming lobbyists without a waiting period) prohibited activities,"['disc_revolving', 'proh_revolving']",2,Revolving door restrictions (lawmakers prohibited from becoming lobbyists without a waiting period)
