paper,indicator_id,indicator_text,section,blob,topics,ntopics,indicator_text_raw
Newmark2017,disclosure.influence_legislation_or_admin,seeking to influence legislation or administrative action (disclosure),Registration and reporting/disclosure requirements,disclosure required: seeking to influence legislation or administrative action registration and reporting/disclosure requirements,[],0,Disclosure required: seeking to influence legislation or administrative action
Newmark2017,disclosure.expenditures_benefiting_officials,expenditures benefiting public officials or employees (disclosure),Registration and reporting/disclosure requirements,disclosure required: expenditures benefiting public officials or employees registration and reporting/disclosure requirements,[],0,Disclosure required: expenditures benefiting public officials or employees
Newmark2017,disclosure.compensation_by_employer,compensation received broken down by employer (disclosure),Registration and reporting/disclosure requirements,disclosure required: compensation received broken down by employer registration and reporting/disclosure requirements,['disc_comp_by_client'],1,Disclosure required: compensation received broken down by employer
Newmark2017,disclosure.total_compensation,total compensation received (disclosure),Registration and reporting/disclosure requirements,disclosure required: total compensation received registration and reporting/disclosure requirements,['disc_comp_total'],1,Disclosure required: total compensation received
Newmark2017,disclosure.categories_of_expenditures,categories of expenditures (disclosure),Registration and reporting/disclosure requirements,disclosure required: categories of expenditures registration and reporting/disclosure requirements,['disc_exp_categories'],1,Disclosure required: categories of expenditures
Newmark2017,disclosure.total_expenditures,total expenditures toward lobbying (disclosure),Registration and reporting/disclosure requirements,disclosure required: total expenditures toward lobbying registration and reporting/disclosure requirements,['disc_exp_total'],1,Disclosure required: total expenditures toward lobbying
Newmark2017,disclosure.contributions_from_others,contributions received from others for lobbying purposes (disclosure),Registration and reporting/disclosure requirements,disclosure required: contributions received from others for lobbying purposes registration and reporting/disclosure requirements,[],0,Disclosure required: contributions received from others for lobbying purposes
OpenSecrets,lobbyist_client_disclosure,"lobbying and who is paying for it (lobbyist and client identification, with separate registrations preferred)",1. Who is lobbying and who is paying for it?,"who is lobbying and who is paying for it (lobbyist and client identification, with separate registrations preferred) 1. who is lobbying and who is paying for it?",['reg_client'],1,"Who is lobbying and who is paying for it (lobbyist and client identification, with separate registrations preferred)"
OpenSecrets,lobbyist_compensation_disclosure,lobbyists getting paid (compensation paid to lobbyists by clients),2. How much are lobbyists getting paid?,how much are lobbyists getting paid (compensation paid to lobbyists by clients) 2. how much are lobbyists getting paid?,['disc_comp_by_client'],1,How much are lobbyists getting paid (compensation paid to lobbyists by clients)
OpenSecrets,timely_disclosure,timely disclosure (frequency/timing of lobbying activity reports),3. Is there timely disclosure?,is there timely disclosure (frequency/timing of lobbying activity reports) 3. is there timely disclosure?,"['def_what_lobbying', 'timeliness']",2,Is there timely disclosure (frequency/timing of lobbying activity reports)
OpenSecrets,public_availability_total,"public access to disclosed information (composite of three sub-facets, total 5 points)",4. How easily can the public access disclosed information?,"how easily can the public access disclosed information (composite of three sub-facets, total 5 points) 4. how easily can the public access disclosed information?",[],0,"How easily can the public access disclosed information (composite of three sub-facets, total 5 points)"
OpenSecrets,public_avail_search,User-friendly search feature on state lobbying disclosure website,4. How easily can the public access disclosed information? (sub-facet a),user-friendly search feature on state lobbying disclosure website 4. how easily can the public access disclosed information? (sub-facet a),"['access_online', 'access_searchable']",2,User-friendly search feature on state lobbying disclosure website
OpenSecrets,public_avail_downloads,Availability of downloadable data from the state lobbying disclosure website,4. How easily can the public access disclosed information? (sub-facet b),availability of downloadable data from the state lobbying disclosure website 4. how easily can the public access disclosed information? (sub-facet b),"['access_online', 'access_bulk']",2,Availability of downloadable data from the state lobbying disclosure website
OpenSecrets,public_avail_lists,Easily accessible lists of registered lobbyists and clients,4. How easily can the public access disclosed information? (sub-facet c),easily accessible lists of registered lobbyists and clients 4. how easily can the public access disclosed information? (sub-facet c),[],0,Easily accessible lists of registered lobbyists and clients
Opheim,def.legislative_lobbying,legislative lobbying (definition criterion),Statutory definition of a lobbyist,legislative lobbying as a criterion for definition statutory definition of a lobbyist,"['def_who_lobbies', 'def_what_lobbying']",2,legislative lobbying as a criterion for definition
Opheim,def.administrative_lobbying,administrative lobbying (definition criterion),Statutory definition of a lobbyist,administrative lobbying as a criterion for definition statutory definition of a lobbyist,"['def_who_lobbies', 'def_what_lobbying']",2,administrative lobbying as a criterion for definition
Opheim,def.elective_officials,elective officials (lobbyist designation),Statutory definition of a lobbyist,elective officials designated as lobbyists statutory definition of a lobbyist,"['def_who_lobbies', 'def_exempt_officials']",2,elective officials designated as lobbyists
Opheim,def.public_employees,public employees (lobbyist designation),Statutory definition of a lobbyist,public employees designated as lobbyists statutory definition of a lobbyist,"['def_who_lobbies', 'def_exempt_officials']",2,public employees designated as lobbyists
Opheim,def.compensation_standard,compensation (lobbyist threshold),Statutory definition of a lobbyist,specific compensation standard to delineate lobbying activity statutory definition of a lobbyist,"['def_who_lobbies', 'def_what_lobbying', 'def_threshold_money']",3,specific compensation standard to delineate lobbying activity
Opheim,def.expenditure_standard,expenditure (lobbyist threshold),Statutory definition of a lobbyist,specific expenditure standard to delineate lobbying activity statutory definition of a lobbyist,"['def_who_lobbies', 'def_what_lobbying', 'def_threshold_money', 'disc_exp_itemized']",4,specific expenditure standard to delineate lobbying activity
Opheim,def.time_standard,time (lobbyist threshold),Statutory definition of a lobbyist,specific time standard to delineate lobbying activity statutory definition of a lobbyist,"['def_who_lobbies', 'def_what_lobbying', 'def_threshold_time']",3,specific time standard to delineate lobbying activity
Opheim,disclosure.frequency,Frequency of reporting required of lobbyists,Frequency and quality of disclosure,frequency of reporting required of lobbyists frequency and quality of disclosure,['freq_cadence'],1,Frequency of reporting required of lobbyists
Opheim,disclosure.total_spending,lobbyist's total spending,Frequency and quality of disclosure,lobbyist's total spending frequency and quality of disclosure,['disc_exp_total'],1,lobbyist's total spending
Opheim,disclosure.spending_by_category,spending by category,Frequency and quality of disclosure,spending by category frequency and quality of disclosure,['disc_exp_categories'],1,spending by category
Opheim,disclosure.expenditures_benefitting_public_employees,expenditures benefitting public employees including gifts,Frequency and quality of disclosure,expenditures benefitting public employees including gifts frequency and quality of disclosure,['disc_gifts'],1,expenditures benefitting public employees including gifts
Opheim,disclosure.legislation_supported_or_opposed,legislation approved or opposed by the lobbyist,Frequency and quality of disclosure,legislation approved or opposed by the lobbyist frequency and quality of disclosure,[],0,legislation approved or opposed by the lobbyist
Opheim,disclosure.sources_of_income,sources of income,Frequency and quality of disclosure,sources of income frequency and quality of disclosure,[],0,sources of income
Opheim,disclosure.total_income,total income,Frequency and quality of disclosure,total income frequency and quality of disclosure,['disc_comp_total'],1,total income
Opheim,disclosure.other_influence_peddling_or_conflict_of_interest,other activities that might constitute influence peddling or conflict of interest,Frequency and quality of disclosure,other activities that might constitute influence peddling or conflict of interest frequency and quality of disclosure,['disc_business_assoc'],1,other activities that might constitute influence peddling or conflict of interest
Opheim,enforce.thoroughness_of_reviews,thoroughness of reviews of lobby reports by oversight agency,Oversight and enforcement of regulations,thoroughness of reviews of lobby reports by oversight agency oversight and enforcement of regulations,"['enforce_oversight_body', 'enforce_review_quality']",2,thoroughness of reviews of lobby reports by oversight agency
Opheim,enforce.subpoena_witnesses,whether the agency may subpoena witnesses,Oversight and enforcement of regulations,whether the agency may subpoena witnesses oversight and enforcement of regulations,['enforce_subpoena'],1,whether the agency may subpoena witnesses
Opheim,enforce.subpoena_records,subpoena records,Oversight and enforcement of regulations,subpoena records oversight and enforcement of regulations,['enforce_subpoena'],1,subpoena records
Opheim,enforce.conduct_administrative_hearings,conduct administrative hearings,Oversight and enforcement of regulations,conduct administrative hearings oversight and enforcement of regulations,['enforce_subpoena'],1,conduct administrative hearings
Opheim,enforce.impose_administrative_fines,impose administrative fines,Oversight and enforcement of regulations,impose administrative fines oversight and enforcement of regulations,['penalties'],1,impose administrative fines
Opheim,enforce.impose_administrative_penalties,impose administrative penalties,Oversight and enforcement of regulations,impose administrative penalties oversight and enforcement of regulations,['penalties'],1,impose administrative penalties
Opheim,enforce.file_independent_court_actions,file independent court actions,Oversight and enforcement of regulations,file independent court actions oversight and enforcement of regulations,['enforce_subpoena'],1,file independent court actions
Sunlight,lobbyist_activity,Lobbyist Activity,Lobbyist Activity,lobbyist activity lobbyist activity,[],0,Lobbyist Activity
Sunlight,expenditure_transparency,Expenditure Transparency,Expenditure Transparency,expenditure transparency expenditure transparency,[],0,Expenditure Transparency
Sunlight,expenditure_reporting_thresholds,Expenditure Reporting Thresholds,Expenditure Reporting Thresholds,expenditure reporting thresholds expenditure reporting thresholds,['disc_exp_threshold'],1,Expenditure Reporting Thresholds
Sunlight,document_accessibility,Document Accessibility,Document Accessibility,document accessibility document accessibility,[],0,Document Accessibility
Sunlight,lobbyist_compensation,Lobbyist Compensation,Lobbyist Compensation,lobbyist compensation lobbyist compensation,[],0,Lobbyist Compensation
