source_paper,source_id,source_text,group_id,group_label
Opheim,enforce.impose_administrative_penalties,impose administrative penalties,g_086,Enforcement: oversight agency may impose administrative penalties (non-fine)
Opheim,enforce.file_independent_court_actions,file independent court actions,g_087,Enforcement: oversight agency may file independent court actions
Sunlight,expenditure_reporting_thresholds,Expenditure Reporting Thresholds,g_088,Reporting: expenditure-reporting threshold (floor below which expenditures need not be itemized/reported)
Sunlight,expenditure_transparency,Expenditure Transparency,g_089,Reporting: overall expenditure transparency
Sunlight,lobbyist_activity,Lobbyist Activity,g_090,Reporting: lobbyist activity disclosure (general)
CPI_2015,C11,Lobbying disclosure,g_091,Composite: presence of a lobbying-disclosure regime
FOCAL,scope.1,"The following types of lobbyists are included in the register: professional lobbyists/consultants, in-house company lobbyists, in-house organisation lobbyists, professional consultancies, law firms, think tanks, research institutions, public entities, government agencies/employees",g_092,"Scope: types of lobbyists covered (consultants, in-house, firms, govt, etc.)"
FOCAL,scope.2,There is no (or low) financial or time threshold to qualify/exempt lobbyists from registration,g_093,Scope: low or no financial/time threshold to qualify lobbyists for registration
FOCAL,scope.3,"The following are included as targets of lobbying: legislative branches, executive branch officials, Ministers, Deputy Ministers, members of parliament, Director-Generals and senior officials, staff, administrative branch/bureaucracy",g_094,"Scope: targets of lobbying covered (legislative, executive, ministers, staff)"
FOCAL,scope.4,"A wide breadth of activities are included, eg, oral, written, electronic, virtual communications; organising meetings for others; events; phone calls and emails",g_095,"Scope: breadth of lobbying activities covered (oral, written, electronic, events)"
FOCAL,descriptors.1,"Full names of lobbyists/organisations, (not abbreviations or ambiguous names)",g_096,Descriptors: full names of lobbyists/organisations on file
FOCAL,descriptors.2,"Contact details provided (eg, Address, telephone and/or website)",g_097,"Descriptors: contact details (address, phone, website) of lobbyists/principals"
FOCAL,descriptors.3,"Legal form (eg, public, private, not-for-profit, NGO, government)",g_098,Descriptors: legal form of organisation (public/private/nonprofit/NGO/govt)
FOCAL,descriptors.4,Company registration number,g_099,Descriptors: company registration number of organisation
FOCAL,descriptors.5,"Sector (eg, transport, energy), sub sector",g_100,Descriptors: sector / sub-sector classification of lobbyist or principal
FOCAL,descriptors.6,"Type of lobbyist contract (eg, salaried staff, contracted)",g_101,Descriptors: type of lobbyist contract (salaried vs contracted)
FOCAL,revolving_door.1,"List of all prior public offices that lobbyists have held, dates when left office",g_102,Revolving door: lobbyists' prior public offices held with departure dates
FOCAL,revolving_door.2,"Database of public officials who are subject to a ban on lobbying (eg, cooling off period)",g_103,Revolving door: database of officials subject to lobbying ban / cooling-off
FOCAL,relationships.1,Client list (for all consultant lobbyists and firms),g_104,Relationships: client list for consultant lobbyists / lobby firms
FOCAL,relationships.2,Names of all sponsors or members (for associations and representative groups),g_105,Relationships: sponsors/members of lobbying associations or representative groups
FOCAL,relationships.3,"List of board seats held (eg, in associations, companies)",g_106,"Relationships: board seats held by lobbyists/principals (in associations, companies)"
FOCAL,relationships.4,"Direct business associations with public officials, candidates or members of their households",g_107,"Relationships: direct business associations with public officials, candidates, or households"
FOCAL,financials.1,Total lobbying income (for consultant lobbyists/lobby firms),g_108,Financials: total lobbying income for consultant lobbyists / firms
FOCAL,financials.2,Lobbying income per client,g_109,Financials: lobbying income broken down per client
FOCAL,financials.3,"Income sources (eg, including government agencies, grant-making foundations, companies) and amount received",g_110,"Financials: income sources (govt, foundations, companies) and amount received"
FOCAL,financials.4,Number of lobbyists employed/contracted (total and full-time equivalent),g_111,Financials: number of lobbyists employed/contracted (total and FTE)
FOCAL,financials.5,Amount of time spent on lobbying,g_112,Financials: amount of time spent on lobbying
FOCAL,financials.6,Total lobbying expenditure (both in-house and consulting),g_113,Financials: total lobbying expenditure (in-house plus consulting)
FOCAL,financials.7,Compensated/uncompensated lobbying activities,g_114,Financials: compensated vs uncompensated lobbying activities flagged
FOCAL,financials.8,Expenditure per issue,g_115,Financials: lobbying expenditure broken down by issue
FOCAL,financials.9,"Expenditure on membership/sponsorship of organisations that lobby (eg, trade associations)",g_116,Financials: expenditure on memberships/sponsorships of lobbying organisations (e.g. trade associations)
FOCAL,financials.10,"Expenditures benefitting public officials or employees including financial/non-financial gifts and support, employer/principal on whose behalf expenses were made",g_117,Financials: expenditures benefiting officials including gifts and the principal on whose behalf made
FOCAL,financials.11,"Campaign/political contributions, including in-kind",g_118,Financials: campaign / political contributions by lobbyists or principals (incl. in-kind)
FOCAL,contact_log.1,Organisation/interest(s) represented (beneficiary),g_119,Contact log: organisation/interest represented (beneficiary) per meeting
FOCAL,contact_log.2,Names of persons contacted and their position/role,g_120,Contact log: names and roles of public officials contacted
FOCAL,contact_log.3,Institution/department contacted,g_121,Contact log: institution/department of officials contacted
FOCAL,contact_log.4,"If a meeting, names of all attendees",g_122,Contact log: names of all attendees at lobbying meetings
FOCAL,contact_log.6,"Form (eg, in person meeting, video conference, phone call)",g_123,"Contact log: form of communication (in-person, video, phone)"
FOCAL,contact_log.7,Location,g_124,Contact log: location of lobbying meeting
FOCAL,contact_log.8,"Any materials that were shared, excluding commercially sensitive materials (before, during and after the meeting)",g_125,Contact log: any materials shared with public officials (excl. commercially sensitive)
FOCAL,contact_log.9,Topics/issues discussed,g_126,Contact log: topics/issues discussed at lobbying meeting
FOCAL,contact_log.10,"Outcomes sought (eg, legislation/policies supported/opposed)",g_127,Contact log: outcomes sought (legislation/policies supported/opposed)
FOCAL,contact_log.11,"Targeted areas of public policy or legislation, including a list of official legislative references/bill numbers/measures etc",g_128,Contact log: targeted public-policy areas / bill numbers / measures
pri_2010,disclosure.A1,Lobbyists.,g_129,Registration scope: lobbyists themselves required to register
pri_2010,disclosure.A2,Volunteer lobbyists.,g_130,Registration scope: volunteer (uncompensated) lobbyists required to register
pri_2010,disclosure.A3,Principals who employ a lobbyist.,g_131,Registration scope: principals who employ a lobbyist required to register
pri_2010,disclosure.A4,Lobbying firms.,g_132,Registration scope: lobbying firms required to register (separately from individual lobbyists)
pri_2010,disclosure.A5,Governor's office.,g_133,Registration scope: governor's office required to register/disclose
pri_2010,disclosure.A6,Executive branch agencies.,g_134,Registration scope: executive-branch agencies required to register/disclose
pri_2010,disclosure.A7,Legislative branch.,g_135,Registration scope: legislative branch required to register/disclose
pri_2010,disclosure.A8,Independent agencies.,g_136,Registration scope: independent agencies required to register/disclose
pri_2010,disclosure.A9,Local governments.,g_137,Registration scope: local governments required to register/disclose
pri_2010,disclosure.A10,Government agencies who lobby other agencies.,g_138,Registration scope: government agencies that lobby other agencies required to register
pri_2010,disclosure.A11,"Public entities, other than government agencies.",g_139,Registration scope: public entities (other than government agencies) required to register
pri_2010,disclosure.B1,Is there an exemption for government agencies and/or public officials acting within their official capacity?,g_140,Government exemption: officials acting within official capacity exempt from lobbying rules
pri_2010,disclosure.B2,Are government agencies relieved and/or exempted (partially) from the regulations imposed on non-government organizations and individuals?,g_141,Government exemption: government agencies partially relieved from lobbying-disclosure rules
pri_2010,disclosure.B3,Are government agencies subject to the same disclosure requirements as lobbyists?,g_142,Government exemption: government agencies subject to the same disclosure as lobbyists
pri_2010,disclosure.B4,Are government agencies subject to the same disclosure requirements as principals?,g_143,Government exemption: government agencies subject to the same disclosure as principals
pri_2010,disclosure.C0,"Does the law include a definition of ""public entity""?",g_144,Definition: law includes a definition of 'public entity'
pri_2010,disclosure.C1,Definition relies on Ownership.,g_145,Definition: 'public entity' definition relies on ownership
pri_2010,disclosure.C2,Definition relies on Structure or composition of revenue.,g_146,Definition: 'public entity' definition relies on revenue structure/composition
pri_2010,disclosure.C3,Definition relies on Public charter or special government protection.,g_147,Definition: 'public entity' definition relies on public charter / special government protection
pri_2010,disclosure.D0,Does the law include a materiality test (ability to exempt) for coverage in disclosure regulations?,g_148,Materiality test: law includes ability to exempt entities below a threshold
pri_2010,disclosure.D1_present,Financial threshold exists: if expenses are less than some dollar threshold the entity is exempted from filing disclosure.,g_149,Materiality test: financial threshold (dollar floor) for disclosure exemption exists
pri_2010,disclosure.D1_value,Dollar threshold value (USD) for financial-threshold exemption.,g_150,Materiality test: dollar value of financial-threshold exemption
pri_2010,disclosure.D2_present,Time threshold exists: if amount of time devoted to lobbying is less than a threshold percentage of an individual's compensated time the individual or entity is exempted from filing disclosure.,g_151,Materiality test: time threshold (% of compensated time) for disclosure exemption exists
pri_2010,disclosure.D2_value,Percentage threshold value for time-threshold exemption.,g_152,Materiality test: percentage value of time-threshold exemption
pri_2010,disclosure.E1a,Are principals required to disclose?,g_153,Principal disclosure: principals required to file disclosure reports
pri_2010,disclosure.E1b,Are principals required to disclose their address and phone number?,g_154,Principal disclosure: principal address and phone number
pri_2010,disclosure.E1c,Are principals required to disclose the names of all the lobbyists representing them?,g_155,Principal disclosure: names of all lobbyists representing the principal
pri_2010,disclosure.E1d,Are principals required to disclose the address and phone number of contracted lobbyists?,g_156,Principal disclosure: address and phone of contracted lobbyists
pri_2010,disclosure.E1e,Are principals required to disclose the nature of the business (public or private)?,g_157,Principal disclosure: nature of principal's business (public or private)
pri_2010,disclosure.E1f_i,Required component of disclosure report: Direct lobbying costs (compensation).,g_158,Principal disclosure: direct lobbying costs (compensation)
pri_2010,disclosure.E1f_ii,Required component of disclosure report: Indirect lobbying costs (non-compensation).,g_159,Principal disclosure: indirect lobbying costs (non-compensation)
pri_2010,disclosure.E1f_iii,"Required component of disclosure report: Other costs such as gifts, entertainment, transportation, and lodging.",g_160,"Principal disclosure: other costs (gifts, entertainment, transportation, lodging)"
pri_2010,disclosure.E1f_iv,Is the information disclosed in an itemized format (as opposed to an aggregated or lump-sum amount)?,g_161,Principal disclosure: information disclosed in itemized format (vs aggregated)
pri_2010,disclosure.E1g_i,Are principals required to disclose information on the issue lobbied by the general issues lobbied?,g_162,Principal disclosure: general issues lobbied on
pri_2010,disclosure.E1g_ii,Are principals required to disclose information on the issue lobbied by the specific bill number or legislation ID?,g_163,Principal disclosure: specific bill number / legislation ID lobbied on
pri_2010,disclosure.E1h_i,Reporting frequency option: Monthly.,g_164,Principal disclosure: monthly reporting frequency option
pri_2010,disclosure.E1h_ii,Reporting frequency option: Quarterly.,g_165,Principal disclosure: quarterly reporting frequency option
pri_2010,disclosure.E1h_iii,Reporting frequency option: Tri-annually (linked with legislative calendar).,g_166,Principal disclosure: tri-annual reporting frequency option (legislative-calendar linked)
pri_2010,disclosure.E1h_iv,Reporting frequency option: Semi-annually.,g_167,Principal disclosure: semi-annual reporting frequency option
pri_2010,disclosure.E1h_v,Reporting frequency option: Annually.,g_168,Principal disclosure: annual reporting frequency option
pri_2010,disclosure.E1h_vi,Reporting frequency option: Other (free-text).,g_169,Principal disclosure: other (free-text) reporting frequency option
pri_2010,disclosure.E1i,Are principals required to disclose contacts?,g_170,Principal disclosure: contacts with public officials disclosed
pri_2010,disclosure.E1j,Are principals required to disclose major financial contributors?,g_171,Principal disclosure: major financial contributors disclosed
pri_2010,disclosure.E2a,Are lobbyists required to disclose?,g_172,Lobbyist disclosure: lobbyists required to file disclosure reports
pri_2010,disclosure.E2b,Are lobbyists required to disclose their address and phone number?,g_173,Lobbyist disclosure: lobbyist address and phone number
pri_2010,disclosure.E2c,Are lobbyists required to disclose the names of all the principals represented?,g_174,Lobbyist disclosure: names of all principals represented
pri_2010,disclosure.E2d,Are lobbyists required to disclose the address and phone number of the principals represented?,g_175,Lobbyist disclosure: address and phone of principals represented
pri_2010,disclosure.E2e,Are lobbyists required to disclose the nature of the principal's business (public or private)?,g_176,Lobbyist disclosure: nature of principal's business (public or private)
pri_2010,disclosure.E2f_i,Required component of disclosure report: Direct lobbying costs (compensation).,g_177,Lobbyist disclosure: direct lobbying costs (compensation)
pri_2010,disclosure.E2f_ii,Required component of disclosure report: Indirect lobbying costs (non-compensation).,g_178,Lobbyist disclosure: indirect lobbying costs (non-compensation)
pri_2010,disclosure.E2f_iii,"Required component of disclosure report: Other costs such as gifts, entertainment, transportation, and lodging.",g_179,"Lobbyist disclosure: other costs (gifts, entertainment, transportation, lodging)"
pri_2010,disclosure.E2f_iv,Is the information disclosed in an itemized format (as opposed to an aggregated or lump-sum amount)?,g_180,Lobbyist disclosure: information disclosed in itemized format (vs aggregated)
pri_2010,disclosure.E2g_i,Are lobbyists required to disclose information on the issue lobbied by the general issues lobbied?,g_181,Lobbyist disclosure: general issues lobbied on
pri_2010,disclosure.E2g_ii,Are lobbyists required to disclose information on the issue lobbied by the specific bill number or legislation ID?,g_182,Lobbyist disclosure: specific bill number / legislation ID lobbied on
pri_2010,disclosure.E2h_i,Reporting frequency option: Monthly.,g_183,Lobbyist disclosure: monthly reporting frequency option
pri_2010,disclosure.E2h_ii,Reporting frequency option: Quarterly.,g_184,Lobbyist disclosure: quarterly reporting frequency option
pri_2010,disclosure.E2h_iii,Reporting frequency option: Tri-annually (linked with legislative calendar).,g_185,Lobbyist disclosure: tri-annual reporting frequency option (legislative-calendar linked)
pri_2010,disclosure.E2h_iv,Reporting frequency option: Semi-annually.,g_186,Lobbyist disclosure: semi-annual reporting frequency option
pri_2010,disclosure.E2h_v,Reporting frequency option: Annually.,g_187,Lobbyist disclosure: annual reporting frequency option
pri_2010,disclosure.E2h_vi,Reporting frequency option: Other (free-text).,g_188,Lobbyist disclosure: other (free-text) reporting frequency option
pri_2010,disclosure.E2i,Are lobbyists required to disclose contacts?,g_189,Lobbyist disclosure: contacts with public officials disclosed
